id	title	description	link	image_link	additional_image_link	availability	price	sale_price	brand	gtin	mpn	condition	identifier_exists	google_product_category	product_type	shipping	shipping_weight	tax	return_policy_label	multipack	is_bundle	age_group	adult	country_of_origin	manufacturer	custom_label_0	custom_label_1	custom_label_2	custom_label_3	custom_label_4
KD-038	Halal Turkey Ham 0.5 kg (0,54 kg) — Kazan Delicacies	Halal Chilled Turkey Ham from Kazan Delicate turkey ham from Kazan Delicacies — perfect for sandwiches, platters, and salads. Halal-certified, made in Kazan. Suitable for HoReCa, wholesale, and retail. Juicy texture, natural taste, -free. Keep at 0–6 °C, shelf life 30 days. Halal Turkey Ham 0.5 kg (0,54 kg) — Kazan Delicacies — halal smoked meats from Kazan Delicacies, refrigerated products category. Net weight: 0,54 kg. Shelf life: 30 days. Storage: 0-6 ˚C. HALAL certified #614A/2024 by the Muslim Spiritual Board of the Republic of Tatarstan (DUM RT). HACCP and ISO 22000 certified production facility. 100% pork-free, made from premium halal meats (beef, turkey, chicken, horse). Wholesale manufacturer direct from Kazan, Tatarstan, Russia. Shipment options: EXW Kazan warehouse or DC Lyubertsy (Moscow region).	https://pepperoni.tatar/en/products/kd-038	https://res.cloudinary.com/duygfl3vz/image/upload/v1772730386/bol_saa_kolbasa_vareno-kopcenaa_mramornaa_blre06.jpg	https://res.cloudinary.com/duygfl3vz/image/upload/v1772730378/mramornaa_vse_vidy_narezki_yrxuek.jpg,https://res.cloudinary.com/duygfl3vz/image/upload/w_800/v1772730471/sosiski_k_zavtraku_xexv.jpg,https://res.cloudinary.com/duygfl3vz/image/upload/w_800/v1772730441/sosiski_k_zavtraku_4_tw.jpg,https://res.cloudinary.com/duygfl3vz/image/upload/w_800/v1772730442/sosiski_k_zavtraku_2_un.jpg,https://res.cloudinary.com/duygfl3vz/image/upload/w_800/v1772730443/sosiski_k_zavtraku_3_hv.jpg,https://res.cloudinary.com/duygfl3vz/image/upload/w_800/v1772730429/sosiski_neznye_apvsmk.jpg	in_stock	362.00 RUB		Kazan Delicacies	4680638721339	995006	new	yes	5740	Refrigerated Products > Smoked Meats > Halal Turkey Ham 0.5 kg (0,54 kg) — Kazan Delicacies	RU:::0.00 RUB	0.540 kg	RU:20:y	no-returns-food		no	adult	no	RU	Kazan Delicacies	halal	refrigerated	Smoked Meats		halal-#614A/2024
KD-039	Halal Marble Beef Ham 0.5 kg (0,27 kg) — Kazan Delicacies	Halal ham from Kazan Marbled beef ham — tender, juicy, with rich meaty flavor. Perfect for sandwiches, salads, and appetizers. Suitable for HoReCa, wholesale, and retail. Halal certified. Made in Kazan, Tatarstan. Store at 0-6°C, shelf life 30 days. Halal Marble Beef Ham 0.5 kg (0,27 kg) — Kazan Delicacies — halal smoked meats from Kazan Delicacies, refrigerated products category. Net weight: 0,27 kg. Shelf life: 30 days. Storage: 0-6 ˚C. HALAL certified #614A/2024 by the Muslim Spiritual Board of the Republic of Tatarstan (DUM RT). HACCP and ISO 22000 certified production facility. 100% pork-free, made from premium halal meats (beef, turkey, chicken, horse). Wholesale manufacturer direct from Kazan, Tatarstan, Russia. Shipment options: EXW Kazan warehouse or DC Lyubertsy (Moscow region).	https://pepperoni.tatar/en/products/kd-039	https://res.cloudinary.com/duygfl3vz/image/upload/v1772730364/kolbasa_vareno-kopcenaa_mramornaa_cdopdr.jpg	https://res.cloudinary.com/duygfl3vz/image/upload/v1772730364/kolbasa_vareno-kopcenaa_mramor_qurfln.jpg,https://res.cloudinary.com/duygfl3vz/image/upload/v1772730378/mramornaa_vse_vidy_narezki_yrxuek.jpg,https://res.cloudinary.com/duygfl3vz/image/upload/w_800/v1772730471/sosiski_k_zavtraku_xexv.jpg,https://res.cloudinary.com/duygfl3vz/image/upload/w_800/v1772730441/sosiski_k_zavtraku_4_tw.jpg,https://res.cloudinary.com/duygfl3vz/image/upload/w_800/v1772730442/sosiski_k_zavtraku_2_un.jpg,https://res.cloudinary.com/duygfl3vz/image/upload/w_800/v1772730443/sosiski_k_zavtraku_3_hv.jpg	in_stock	181.00 RUB		Kazan Delicacies	4680638721346	995011	new	yes	5740	Refrigerated Products > Smoked Meats > Halal Marble Beef Ham 0.5 kg (0,27 kg) — Kazan Delicacies	RU:::0.00 RUB	0.270 kg	RU:20:y	no-returns-food		no	adult	no	RU	Kazan Delicacies	halal	refrigerated	Smoked Meats		halal-#614A/2024
KD-040	Chicken Ham Halal 0.5 kg (0,54 kg) — Kazan Delicacies	Chilled Halal Chicken Ham, Kazan Tender and juicy chicken ham, produced in Kazan according to Halal standards. Perfect for sandwiches, salads, and snacks. Suitable for HoReCa, wholesale, and retail. Chilled product, shelf life 30 days at 0–6 °C. Natural ingredients, no unnecessary additives. Great choice for healthy eating and daily meals. Chicken Ham Halal 0.5 kg (0,54 kg) — Kazan Delicacies — halal smoked meats from Kazan Delicacies, refrigerated products category. Net weight: 0,54 kg. Shelf life: 30 days. Storage: 0-6 ˚C. HALAL certified #614A/2024 by the Muslim Spiritual Board of the Republic of Tatarstan (DUM RT). HACCP and ISO 22000 certified production facility. 100% pork-free, made from premium halal meats (beef, turkey, chicken, horse). Wholesale manufacturer direct from Kazan, Tatarstan, Russia. Shipment options: EXW Kazan warehouse or DC Lyubertsy (Moscow region).	https://pepperoni.tatar/en/products/kd-040	https://res.cloudinary.com/duygfl3vz/image/upload/v1772730371/bol_soi%CC%86_servelat_vareno-kopcenyi%CC%86_filei%CC%86nyi%CC%86_lnnvru.jpg	https://res.cloudinary.com/duygfl3vz/image/upload/v1772730383/dlinnaa_servelat_filei%CC%86nyi%CC%86_fbplzi.jpg,https://res.cloudinary.com/duygfl3vz/image/upload/v1784228298/%D0%A1%D0%B5%D1%80%D0%B2%D0%B5%D0%BB%D0%B0%D1%82_%D1%84%D0%B8%D0%BB%D0%B5%D0%B8%CC%86%D0%BD%D1%8B%D0%B8%CC%86_%D0%B2%D1%81%D0%B5_%D0%B2%D0%B8%D0%B4%D1%8B_%D0%BD%D0%B0%D1%80%D0%B5%D0%B7%D0%BA%D0%B8_gyhivb.jpg,https://res.cloudinary.com/duygfl3vz/image/upload/w_800/v1772730471/sosiski_k_zavtraku_xexv.jpg,https://res.cloudinary.com/duygfl3vz/image/upload/w_800/v1772730441/sosiski_k_zavtraku_4_tw.jpg,https://res.cloudinary.com/duygfl3vz/image/upload/w_800/v1772730442/sosiski_k_zavtraku_2_un.jpg,https://res.cloudinary.com/duygfl3vz/image/upload/w_800/v1772730443/sosiski_k_zavtraku_3_hv.jpg	in_stock	333.00 RUB		Kazan Delicacies	4680638721353	995007	new	yes	5740	Refrigerated Products > Smoked Meats > Chicken Ham Halal 0.5 kg (0,54 kg) — Kazan Delicacies	RU:::0.00 RUB	0.540 kg	RU:20:y	no-returns-food		no	adult	no	RU	Kazan Delicacies	halal	refrigerated	Smoked Meats		halal-#614A/2024
KD-041	Halal Filley Ham 0.5 kg (0,27 kg) — Kazan Delicacies	Halal ham from Kazan Tender Filley Ham by Kazan Delicacies — a chilled product with classic flavor, perfect for sandwiches, salads, and appetizers. Made in Tatarstan according to halal standards. Suitable for HoReCa, wholesale, and retail. Shelf life 30 days at 0–6 °C. Halal Filley Ham 0.5 kg (0,27 kg) — Kazan Delicacies — halal smoked meats from Kazan Delicacies, refrigerated products category. Net weight: 0,27 kg. Shelf life: 30 days. Storage: 0-6 ˚C. HALAL certified #614A/2024 by the Muslim Spiritual Board of the Republic of Tatarstan (DUM RT). HACCP and ISO 22000 certified production facility. 100% pork-free, made from premium halal meats (beef, turkey, chicken, horse). Wholesale manufacturer direct from Kazan, Tatarstan, Russia. Shipment options: EXW Kazan warehouse or DC Lyubertsy (Moscow region).	https://pepperoni.tatar/en/products/kd-041	https://res.cloudinary.com/duygfl3vz/image/upload/v1784228206/%D0%A1%D0%B5%D1%80%D0%B2%D0%B5%D0%BB%D0%B0%D1%82_%D0%B2%D0%B0%D1%80%D0%B5%D0%BD%D0%BE_%D0%BA%D0%BE%D0%BF%D1%87%D0%B5%D0%BD%D1%8B%D0%B8%CC%86_%D1%84%D0%B8%D0%BB%D0%B5%D0%B8%CC%86%D0%BD%D1%8B%D0%B8%CC%86_bb0jum.jpg	https://res.cloudinary.com/duygfl3vz/image/upload/v1784228304/%D0%A1%D0%B5%D1%80%D0%B2%D0%B5%D0%BB%D0%B0%D1%82_%D1%84%D0%B8%D0%BB%D0%B5%D0%B8%CC%86%D0%BD%D1%8B%D0%B8%CC%86_vqdd44.jpg,https://res.cloudinary.com/duygfl3vz/image/upload/w_800/v1772730471/sosiski_k_zavtraku_xexv.jpg,https://res.cloudinary.com/duygfl3vz/image/upload/w_800/v1772730441/sosiski_k_zavtraku_4_tw.jpg,https://res.cloudinary.com/duygfl3vz/image/upload/w_800/v1772730442/sosiski_k_zavtraku_2_un.jpg,https://res.cloudinary.com/duygfl3vz/image/upload/w_800/v1772730443/sosiski_k_zavtraku_3_hv.jpg,https://res.cloudinary.com/duygfl3vz/image/upload/w_800/v1772730429/sosiski_neznye_apvsmk.jpg	in_stock	166.00 RUB		Kazan Delicacies	4680638721360	995013	new	yes	5740	Refrigerated Products > Smoked Meats > Halal Filley Ham 0.5 kg (0,27 kg) — Kazan Delicacies	RU:::0.00 RUB	0.270 kg	RU:20:y	no-returns-food		no	adult	no	RU	Kazan Delicacies	halal	refrigerated	Smoked Meats		halal-#614A/2024
KD-042	Halal Servelat Khansky 0.45 kg (0,54 kg) — Kazan Delicacies	Smoked servelat from Tatarstan, halal Enjoy the refined taste of smoked servelat 'Khansky' from Kazan Delicacies. Made from selected meat with traditional smoking and spices. Perfect for breakfast, sandwiches, or meat platters in HoReCa. Halal certified, produced in Kazan. Suitable for wholesale and retail. Store at 0-6°C, shelf life 30 days. Halal Servelat Khansky 0.45 kg (0,54 kg) — Kazan Delicacies — halal smoked meats from Kazan Delicacies, refrigerated products category. Net weight: 0,54 kg. Shelf life: 30 days. Storage: 0-6 ˚C. HALAL certified #614A/2024 by the Muslim Spiritual Board of the Republic of Tatarstan (DUM RT). HACCP and ISO 22000 certified production facility. 100% pork-free, made from premium halal meats (beef, turkey, chicken, horse). Wholesale manufacturer direct from Kazan, Tatarstan, Russia. Shipment options: EXW Kazan warehouse or DC Lyubertsy (Moscow region).	https://pepperoni.tatar/en/products/kd-042	https://res.cloudinary.com/duygfl3vz/image/upload/v1772730371/bol_saa_kolbasa_vareno-kopcenaa_knazeskaa_tlteyj.jpg	https://res.cloudinary.com/duygfl3vz/image/upload/w_800/v1772730471/sosiski_k_zavtraku_xexv.jpg,https://res.cloudinary.com/duygfl3vz/image/upload/w_800/v1772730441/sosiski_k_zavtraku_4_tw.jpg,https://res.cloudinary.com/duygfl3vz/image/upload/w_800/v1772730442/sosiski_k_zavtraku_2_un.jpg,https://res.cloudinary.com/duygfl3vz/image/upload/w_800/v1772730443/sosiski_k_zavtraku_3_hv.jpg,https://res.cloudinary.com/duygfl3vz/image/upload/w_800/v1772730429/sosiski_neznye_apvsmk.jpg,https://res.cloudinary.com/duygfl3vz/image/upload/w_800/v1772730430/sosiski_neznaa_jqh4xv.jpg	in_stock	362.00 RUB		Kazan Delicacies	4680638721377	995008	new	yes	5740	Refrigerated Products > Smoked Meats > Halal Servelat Khansky 0.45 kg (0,54 kg) — Kazan Delicacies	RU:::0.00 RUB	0.540 kg	RU:20:y	no-returns-food		no	adult	no	RU	Kazan Delicacies	halal	refrigerated	Smoked Meats		halal-#614A/2024
KD-043	Halal Smoked Chicken Fillet (0,27 kg) — Kazan Delicacies	Chilled smoked chicken fillet by Kazan Delicacies Tender smoked chicken fillet with a delicate smoky aroma and rich flavour, crafted in Kazan from certified halal poultry. Perfect for cold cuts, salads and hot dishes. Suitable for HoReCa, retail and wholesale. Halal certified (DUM RT №614A/2024). Storage 0–6 °C, shelf life 30 days. Halal Smoked Chicken Fillet (0,27 kg) — Kazan Delicacies — halal smoked meats from Kazan Delicacies, refrigerated products category. Net weight: 0,27 kg. Shelf life: 30 days. Storage: 0-6 ˚C. HALAL certified #614A/2024 by the Muslim Spiritual Board of the Republic of Tatarstan (DUM RT). HACCP and ISO 22000 certified production facility. 100% pork-free, made from premium halal meats (beef, turkey, chicken, horse). Wholesale manufacturer direct from Kazan, Tatarstan, Russia. Shipment options: EXW Kazan warehouse or DC Lyubertsy (Moscow region).	https://pepperoni.tatar/en/products/kd-043	https://res.cloudinary.com/duygfl3vz/image/upload/v1772730362/kolbasa_vareno-kopcenaa_knazeskaa_g5prfg.jpg	https://res.cloudinary.com/duygfl3vz/image/upload/w_800/v1772730471/sosiski_k_zavtraku_xexv.jpg,https://res.cloudinary.com/duygfl3vz/image/upload/w_800/v1772730441/sosiski_k_zavtraku_4_tw.jpg,https://res.cloudinary.com/duygfl3vz/image/upload/w_800/v1772730442/sosiski_k_zavtraku_2_un.jpg,https://res.cloudinary.com/duygfl3vz/image/upload/w_800/v1772730443/sosiski_k_zavtraku_3_hv.jpg,https://res.cloudinary.com/duygfl3vz/image/upload/w_800/v1772730429/sosiski_neznye_apvsmk.jpg,https://res.cloudinary.com/duygfl3vz/image/upload/w_800/v1772730430/sosiski_neznaa_jqh4xv.jpg	in_stock	181.00 RUB		Kazan Delicacies	4680638721384	995010	new	yes	5740	Refrigerated Products > Smoked Meats > Halal Smoked Chicken Fillet (0,27 kg) — Kazan Delicacies	RU:::0.00 RUB	0.270 kg	RU:20:y	no-returns-food		no	adult	no	RU	Kazan Delicacies	halal	refrigerated	Smoked Meats		halal-#614A/2024
KD-044	Halal Smoked Turkey Sausage (0,2 kg) — Kazan Delicacies	Halal, 450 g, 30 days Delicate semi-smoked turkey sausage with a light smoky aroma. Perfect for sandwiches, cold cuts, and hot dishes. Made in Kazan according to Halal standards. Suitable for HoReCa, wholesale, and retail. Rich in protein, low in fat. Halal Smoked Turkey Sausage (0,2 kg) — Kazan Delicacies — halal premium kazylyk from Kazan Delicacies, refrigerated products category. Net weight: 0,2 kg. Shelf life: 180 days. Storage: 0-12 ˚C. HALAL certified #614A/2024 by the Muslim Spiritual Board of the Republic of Tatarstan (DUM RT). HACCP and ISO 22000 certified production facility. 100% pork-free, made from premium halal meats (beef, turkey, chicken, horse). Wholesale manufacturer direct from Kazan, Tatarstan, Russia. Shipment options: EXW Kazan warehouse or DC Lyubertsy (Moscow region).	https://pepperoni.tatar/en/products/kd-044	https://res.cloudinary.com/duygfl3vz/image/upload/v1772700368/kyzylyk_i_upakovka_1.4_rv2hvw.jpg	https://res.cloudinary.com/duygfl3vz/image/upload/v1772700370/kyzylyk_i_upakovka_1.0_vi99ww.jpg,https://res.cloudinary.com/duygfl3vz/image/upload/v1772730300/sosiski_dla_hot_dogov_tri_perza_s_syrom_v7sbbt.jpg,https://res.cloudinary.com/duygfl3vz/image/upload/w_800/v1772730471/sosiski_k_zavtraku_xexv.jpg,https://res.cloudinary.com/duygfl3vz/image/upload/w_800/v1772730441/sosiski_k_zavtraku_4_tw.jpg,https://res.cloudinary.com/duygfl3vz/image/upload/w_800/v1772730442/sosiski_k_zavtraku_2_un.jpg,https://res.cloudinary.com/duygfl3vz/image/upload/w_800/v1772730443/sosiski_k_zavtraku_3_hv.jpg	in_stock	650.00 RUB		Kazan Delicacies	4680638721209	999911	new	yes	5740	Refrigerated Products > Premium Kazylyk > Halal Smoked Turkey Sausage (0,2 kg) — Kazan Delicacies	RU:::0.00 RUB	0.200 kg	RU:20:y	no-returns-food		no	adult	no	RU	Kazan Delicacies	halal	refrigerated	Premium Kazylyk		halal-#614A/2024
KD-045	Authentic Kazylik, prepared according to the classic Tatar recipe, sliced into thin slices for convenient use in cafes, restaurants, hotels, shops, an	Authentic Kazylik, prepared according to the classic Tatar recipe, sliced into thin slices for convenient use in cafes, restaurants, hotels, shops, an — halal premium kazylyk from Kazan Delicacies, refrigerated products category. Net weight: 0,1 kg. Shelf life: 30 days. Storage: 0-12 ˚C. HALAL certified #614A/2024 by the Muslim Spiritual Board of the Republic of Tatarstan (DUM RT). HACCP and ISO 22000 certified production facility. 100% pork-free, made from premium halal meats (beef, turkey, chicken, horse). Wholesale manufacturer direct from Kazan, Tatarstan, Russia. Shipment options: EXW Kazan warehouse or DC Lyubertsy (Moscow region).	https://pepperoni.tatar/en/products/kd-045	https://res.cloudinary.com/duygfl3vz/image/upload/v1772700322/kyzylyk_narezka_bez_upakovki_1.6_gtkdqm.jpg	https://res.cloudinary.com/duygfl3vz/image/upload/w_800/v1772730471/sosiski_k_zavtraku_xexv.jpg,https://res.cloudinary.com/duygfl3vz/image/upload/w_800/v1772730441/sosiski_k_zavtraku_4_tw.jpg,https://res.cloudinary.com/duygfl3vz/image/upload/w_800/v1772730442/sosiski_k_zavtraku_2_un.jpg,https://res.cloudinary.com/duygfl3vz/image/upload/w_800/v1772730443/sosiski_k_zavtraku_3_hv.jpg,https://res.cloudinary.com/duygfl3vz/image/upload/w_800/v1772730429/sosiski_neznye_apvsmk.jpg,https://res.cloudinary.com/duygfl3vz/image/upload/w_800/v1772730430/sosiski_neznaa_jqh4xv.jpg	in_stock	450.00 RUB		Kazan Delicacies	4680638721148	999909	new	yes	5740	Refrigerated Products > Premium Kazylyk > Authentic Kazylik, prepared according to the classic Tatar recipe, sliced into thin slices for convenient use in cafes, restaurants, hotels, shops, an	RU:::0.00 RUB	0.100 kg	RU:20:y	no-returns-food		no	adult	no	RU	Kazan Delicacies	halal	refrigerated	Premium Kazylyk		halal-#614A/2024
KD-046	Halal Gubadiya with kort 100 g (100 г kg) — Kazan Delicacies	Halal Tatar pastry, frozen –18°C Classic gubadiya with soft kort from Kazan Delicacies. Traditional pastry from Kazan for cafés, restaurants, wholesale and retail. Halal DUM RT. Shelf life 360 days at –18°C. Halal Gubadiya with kort 100 g (100 г kg) — Kazan Delicacies — halal traditional tatar pastries from Kazan Delicacies, bakery category. Net weight: 100 г kg. Shelf life: 360 days. Storage: –18°C. HALAL certified #614A/2024 by the Muslim Spiritual Board of the Republic of Tatarstan (DUM RT). HACCP and ISO 22000 certified production facility. 100% pork-free, made from premium halal meats (beef, turkey, chicken, horse). Wholesale manufacturer direct from Kazan, Tatarstan, Russia. Shipment options: EXW Kazan warehouse or DC Lyubertsy (Moscow region).	https://pepperoni.tatar/en/products/kd-046	https://res.cloudinary.com/duygfl3vz/image/upload/v1778667339/products/kd-059.jpg	https://res.cloudinary.com/duygfl3vz/image/upload/v1778602962/products/gubadiya-v-razreze.jpg,https://res.cloudinary.com/duygfl3vz/image/upload/v1778602961/products/gubadiya.jpg,https://res.cloudinary.com/duygfl3vz/image/upload/w_800/v1778667339/products/kd-059.jpg,https://res.cloudinary.com/duygfl3vz/image/upload/w_800/v1778602962/products/gubadiya-v-raz.jpg,https://res.cloudinary.com/duygfl3vz/image/upload/w_800/v1778602961/products/gubadiya.jpg,https://res.cloudinary.com/duygfl3vz/image/upload/w_800/v1778667341/products/kd-060.jpg	in_stock	56.00 RUB		Kazan Delicacies	4680638720844	KD-046	new	yes	1876	Bakery > Traditional Tatar Pastries > Halal Gubadiya with kort 100 g (100 г kg) — Kazan Delicacies	RU:::0.00 RUB	0.100 kg	RU:20:y	no-returns-food	48	no	adult	no	RU	Kazan Delicacies	halal	bakery	Traditional Tatar Pastries		halal-#614A/2024
KD-047	Halal Fried cheburek 100 g (100 г kg) — Kazan Delicacies	Halal Tatar pastry, frozen –18°C Juicy fried cheburek with meat filling — a ready-to-heat product. Suitable for HoReCa, street food and retail. Made by Kazan Delicacies in Kazan. Halal DUM RT. Store 360 days at –18°C. Halal Fried cheburek 100 g (100 г kg) — Kazan Delicacies — halal traditional tatar pastries from Kazan Delicacies, bakery category. Net weight: 100 г kg. Shelf life: 360 days. Storage: –18°C. HALAL certified #614A/2024 by the Muslim Spiritual Board of the Republic of Tatarstan (DUM RT). HACCP and ISO 22000 certified production facility. 100% pork-free, made from premium halal meats (beef, turkey, chicken, horse). Wholesale manufacturer direct from Kazan, Tatarstan, Russia. Shipment options: EXW Kazan warehouse or DC Lyubertsy (Moscow region).	https://pepperoni.tatar/en/products/kd-047	https://res.cloudinary.com/duygfl3vz/image/upload/v1778667341/products/kd-060.jpg	https://res.cloudinary.com/duygfl3vz/image/upload/v1778604348/products/cheburek-v-razreze.jpg,https://res.cloudinary.com/duygfl3vz/image/upload/v1778604346/products/cheburek.jpg,https://res.cloudinary.com/duygfl3vz/image/upload/w_800/v1778667339/products/kd-059.jpg,https://res.cloudinary.com/duygfl3vz/image/upload/w_800/v1778602962/products/gubadiya-v-raz.jpg,https://res.cloudinary.com/duygfl3vz/image/upload/w_800/v1778602961/products/gubadiya.jpg,https://res.cloudinary.com/duygfl3vz/image/upload/w_800/v1778667341/products/kd-060.jpg	in_stock	58.86 RUB		Kazan Delicacies	4680638721032	KD-047	new	yes	1876	Bakery > Traditional Tatar Pastries > Halal Fried cheburek 100 g (100 г kg) — Kazan Delicacies	RU:::0.00 RUB	0.100 kg	RU:20:y	no-returns-food	30	no	adult	no	RU	Kazan Delicacies	halal	bakery	Traditional Tatar Pastries		halal-#614A/2024
KD-048	Halal Fried peremyach 100 g (100 г kg) — Kazan Delicacies	Halal meat pastry from Tatarstan Fried peremyach — round Tatar pastry with meat filling. Convenient format for cafés, canteens and wholesale. Kazan Delicacies, Kazan. Halal DUM RT. Frozen, shelf life 360 days at –18°C. Halal Fried peremyach 100 g (100 г kg) — Kazan Delicacies — halal traditional tatar pastries from Kazan Delicacies, bakery category. Net weight: 100 г kg. Shelf life: 360 days. Storage: –18°C. HALAL certified #614A/2024 by the Muslim Spiritual Board of the Republic of Tatarstan (DUM RT). HACCP and ISO 22000 certified production facility. 100% pork-free, made from premium halal meats (beef, turkey, chicken, horse). Wholesale manufacturer direct from Kazan, Tatarstan, Russia. Shipment options: EXW Kazan warehouse or DC Lyubertsy (Moscow region).	https://pepperoni.tatar/en/products/kd-048	https://res.cloudinary.com/duygfl3vz/image/upload/v1778667342/products/kd-061.jpg	https://res.cloudinary.com/duygfl3vz/image/upload/v1778602964/products/peremyach-v-razreze.jpg,https://res.cloudinary.com/duygfl3vz/image/upload/v1778602963/products/peremyach.jpg,https://res.cloudinary.com/duygfl3vz/image/upload/w_800/v1778667339/products/kd-059.jpg,https://res.cloudinary.com/duygfl3vz/image/upload/w_800/v1778602962/products/gubadiya-v-raz.jpg,https://res.cloudinary.com/duygfl3vz/image/upload/w_800/v1778602961/products/gubadiya.jpg,https://res.cloudinary.com/duygfl3vz/image/upload/w_800/v1778667341/products/kd-060.jpg	in_stock	59.14 RUB		Kazan Delicacies	4680638720851	KD-048	new	yes	1876	Bakery > Traditional Tatar Pastries > Halal Fried peremyach 100 g (100 г kg) — Kazan Delicacies	RU:::0.00 RUB	0.100 kg	RU:20:y	no-returns-food	48	no	adult	no	RU	Kazan Delicacies	halal	bakery	Traditional Tatar Pastries		halal-#614A/2024
KD-049	Halal Chicken samsa 120 g (120 г kg) — Kazan Delicacies	Halal flaky pastry, frozen Samsa with chicken filling in flaky dough. For bakeries, cafés, wholesale and retail. Produced in Kazan by Kazan Delicacies. Halal DUM RT. Store 360 days at –18°C. Halal Chicken samsa 120 g (120 г kg) — Kazan Delicacies — halal traditional tatar pastries from Kazan Delicacies, bakery category. Net weight: 120 г kg. Shelf life: 360 days. Storage: –18°C. HALAL certified #614A/2024 by the Muslim Spiritual Board of the Republic of Tatarstan (DUM RT). HACCP and ISO 22000 certified production facility. 100% pork-free, made from premium halal meats (beef, turkey, chicken, horse). Wholesale manufacturer direct from Kazan, Tatarstan, Russia. Shipment options: EXW Kazan warehouse or DC Lyubertsy (Moscow region).	https://pepperoni.tatar/en/products/kd-049	https://res.cloudinary.com/duygfl3vz/image/upload/v1778667343/products/kd-062.jpg	https://res.cloudinary.com/duygfl3vz/image/upload/v1778602968/products/samsa-kurica.jpg,https://res.cloudinary.com/duygfl3vz/image/upload/w_800/v1778667339/products/kd-059.jpg,https://res.cloudinary.com/duygfl3vz/image/upload/w_800/v1778602962/products/gubadiya-v-raz.jpg,https://res.cloudinary.com/duygfl3vz/image/upload/w_800/v1778602961/products/gubadiya.jpg,https://res.cloudinary.com/duygfl3vz/image/upload/w_800/v1778667341/products/kd-060.jpg,https://res.cloudinary.com/duygfl3vz/image/upload/w_800/v1778604348/products/cheburek-v-raz.jpg	in_stock	61.73 RUB		Kazan Delicacies	4680638720813	KD-049	new	yes	1876	Bakery > Traditional Tatar Pastries > Halal Chicken samsa 120 g (120 г kg) — Kazan Delicacies	RU:::0.00 RUB	0.120 kg	RU:20:y	no-returns-food	48	no	adult	no	RU	Kazan Delicacies	halal	bakery	Traditional Tatar Pastries		halal-#614A/2024
KD-050	Halal Echpochmak with beef and potato 100 g (100 г kg) — Kazan Delicacies	Classic Halal Tatar triangle Echpochmak filled with beef and potato. Traditional pastry for HoReCa and retail. Kazan Delicacies, Kazan. Halal DUM RT. Frozen, 360 days at –18°C. Halal Echpochmak with beef and potato 100 g (100 г kg) — Kazan Delicacies — halal traditional tatar pastries from Kazan Delicacies, bakery category. Net weight: 100 г kg. Shelf life: 360 days. Storage: –18°C. HALAL certified #614A/2024 by the Muslim Spiritual Board of the Republic of Tatarstan (DUM RT). HACCP and ISO 22000 certified production facility. 100% pork-free, made from premium halal meats (beef, turkey, chicken, horse). Wholesale manufacturer direct from Kazan, Tatarstan, Russia. Shipment options: EXW Kazan warehouse or DC Lyubertsy (Moscow region).	https://pepperoni.tatar/en/products/kd-050	https://res.cloudinary.com/duygfl3vz/image/upload/v1778667344/products/kd-063.jpg	https://res.cloudinary.com/duygfl3vz/image/upload/v1778604350/products/echpochmak-v-razreze.jpg,https://res.cloudinary.com/duygfl3vz/image/upload/v1778604349/products/echpochmak.jpg,https://res.cloudinary.com/duygfl3vz/image/upload/w_800/v1778667339/products/kd-059.jpg,https://res.cloudinary.com/duygfl3vz/image/upload/w_800/v1778602962/products/gubadiya-v-raz.jpg,https://res.cloudinary.com/duygfl3vz/image/upload/w_800/v1778602961/products/gubadiya.jpg,https://res.cloudinary.com/duygfl3vz/image/upload/w_800/v1778667341/products/kd-060.jpg	in_stock	68.77 RUB		Kazan Delicacies	4680638720660	KD-050	new	yes	1876	Bakery > Traditional Tatar Pastries > Halal Echpochmak with beef and potato 100 g (100 г kg) — Kazan Delicacies	RU:::0.00 RUB	0.100 kg	RU:20:y	no-returns-food	48	no	adult	no	RU	Kazan Delicacies	halal	bakery	Traditional Tatar Pastries		halal-#614A/2024
