id	title	description	link	image_link	additional_image_link	availability	price	sale_price	brand	gtin	mpn	condition	identifier_exists	google_product_category	product_type	shipping	shipping_weight	tax	return_policy_label	multipack	is_bundle	age_group	adult	country_of_origin	manufacturer	custom_label_0	custom_label_1	custom_label_2	custom_label_3	custom_label_4
KD-025	Halal Beef 1st grade diced 1x1 cm (0,5 kg) — Kazan Delicacies	Frozen halal beef cubes for soups & stews Premium quality beef cubes, hand-cut in Kazan, Tatarstan. First-grade beef individually quick-frozen to lock in flavor and tenderness. Perfect for soups, stews, pilaf, pastry fillings, and sauces. Halal certified. Shelf life 180 days at –18°C. Ideal for HoReCa, wholesale, and retail. Halal Beef 1st grade diced 1x1 cm (0,5 kg) — Kazan Delicacies — halal boiled sausages from Kazan Delicacies, refrigerated products category. Net weight: 0,5 kg. Shelf life: 30 days. Storage: 0-6 ˚C. Casing: natural casing. HALAL certified #614A/2024 by the Muslim Spiritual Board of the Republic of Tatarstan (DUM RT). HACCP and ISO 22000 certified production facility. 100% pork-free, made from premium halal meats (beef, turkey, chicken, horse). Wholesale manufacturer direct from Kazan, Tatarstan, Russia. Shipment options: EXW Kazan warehouse or DC Lyubertsy (Moscow region).	https://pepperoni.tatar/en/products/kd-025	https://res.cloudinary.com/duygfl3vz/image/upload/w_800/v1772730471/sosiski_k_zavtraku_xexv.jpg	https://res.cloudinary.com/duygfl3vz/image/upload/w_800/v1772730441/sosiski_k_zavtraku_4_tw.jpg,https://res.cloudinary.com/duygfl3vz/image/upload/w_800/v1772730442/sosiski_k_zavtraku_2_un.jpg,https://res.cloudinary.com/duygfl3vz/image/upload/w_800/v1772730443/sosiski_k_zavtraku_3_hv.jpg,https://res.cloudinary.com/duygfl3vz/image/upload/w_800/v1772730429/sosiski_neznye_apvsmk.jpg,https://res.cloudinary.com/duygfl3vz/image/upload/w_800/v1772730430/sosiski_neznaa_jqh4xv.jpg,https://res.cloudinary.com/duygfl3vz/image/upload/w_800/v1772730460/kazanskie_molocnye_sosi.jpg	in_stock	292.00 RUB		Kazan Delicacies	4680638720257	999998	new	yes	5740	Refrigerated Products > Boiled Sausages > Halal Beef 1st grade diced 1x1 cm (0,5 kg) — Kazan Delicacies	RU:::0.00 RUB	0.500 kg	RU:20:y	no-returns-food		no	adult	no	RU	Kazan Delicacies	halal	refrigerated	Boiled Sausages		halal-#614A/2024
KD-026	Halal Boiled Assorted Sausage (0,5 kg) — Kazan Delicacies	Halal Boiled Assorted Sausage (0,5 kg) — Kazan Delicacies — halal boiled sausages from Kazan Delicacies, refrigerated products category. Net weight: 0,5 kg. Shelf life: 30 days. Storage: 0-6 ˚C. Casing: natural casing. HALAL certified #614A/2024 by the Muslim Spiritual Board of the Republic of Tatarstan (DUM RT). HACCP and ISO 22000 certified production facility. 100% pork-free, made from premium halal meats (beef, turkey, chicken, horse). Wholesale manufacturer direct from Kazan, Tatarstan, Russia. Shipment options: EXW Kazan warehouse or DC Lyubertsy (Moscow region).	https://pepperoni.tatar/en/products/kd-026	https://res.cloudinary.com/duygfl3vz/image/upload/w_800/v1772730471/sosiski_k_zavtraku_xexv.jpg	https://res.cloudinary.com/duygfl3vz/image/upload/w_800/v1772730441/sosiski_k_zavtraku_4_tw.jpg,https://res.cloudinary.com/duygfl3vz/image/upload/w_800/v1772730442/sosiski_k_zavtraku_2_un.jpg,https://res.cloudinary.com/duygfl3vz/image/upload/w_800/v1772730443/sosiski_k_zavtraku_3_hv.jpg,https://res.cloudinary.com/duygfl3vz/image/upload/w_800/v1772730429/sosiski_neznye_apvsmk.jpg,https://res.cloudinary.com/duygfl3vz/image/upload/w_800/v1772730430/sosiski_neznaa_jqh4xv.jpg,https://res.cloudinary.com/duygfl3vz/image/upload/w_800/v1772730460/kazanskie_molocnye_sosi.jpg	in_stock	197.00 RUB		Kazan Delicacies	4680638721292	995003	new	yes	5740	Refrigerated Products > Boiled Sausages > Halal Boiled Assorted Sausage (0,5 kg) — Kazan Delicacies	RU:::0.00 RUB	0.500 kg	RU:20:y	no-returns-food		no	adult	no	RU	Kazan Delicacies	halal	refrigerated	Boiled Sausages		halal-#614A/2024
KD-027	Halal Sausages 'For Breakfast' without casing 45 g (0,5 kg) — Kazan Delicacies	Halal, chilled, for baking Juicy halal skinless sausages 45 g each, perfect for dough-wrapped snacks. Delicate taste, firm texture. Made in Kazan, Tatarstan. Halal certified. Suitable for HoReCa, wholesale, and retail. Shelf life 30 days at 0-6°C. Halal Sausages 'For Breakfast' without casing 45 g (0,5 kg) — Kazan Delicacies — halal boiled sausages from Kazan Delicacies, refrigerated products category. Net weight: 0,5 kg. Shelf life: 30 days. Storage: 0-6 ˚C. Casing: natural casing. HALAL certified #614A/2024 by the Muslim Spiritual Board of the Republic of Tatarstan (DUM RT). HACCP and ISO 22000 certified production facility. 100% pork-free, made from premium halal meats (beef, turkey, chicken, horse). Wholesale manufacturer direct from Kazan, Tatarstan, Russia. Shipment options: EXW Kazan warehouse or DC Lyubertsy (Moscow region).	https://pepperoni.tatar/en/products/kd-027	https://res.cloudinary.com/duygfl3vz/image/upload/w_800/v1772730471/sosiski_k_zavtraku_xexv.jpg	https://res.cloudinary.com/duygfl3vz/image/upload/w_800/v1772730441/sosiski_k_zavtraku_4_tw.jpg,https://res.cloudinary.com/duygfl3vz/image/upload/w_800/v1772730442/sosiski_k_zavtraku_2_un.jpg,https://res.cloudinary.com/duygfl3vz/image/upload/w_800/v1772730443/sosiski_k_zavtraku_3_hv.jpg,https://res.cloudinary.com/duygfl3vz/image/upload/w_800/v1772730429/sosiski_neznye_apvsmk.jpg,https://res.cloudinary.com/duygfl3vz/image/upload/w_800/v1772730430/sosiski_neznaa_jqh4xv.jpg,https://res.cloudinary.com/duygfl3vz/image/upload/w_800/v1772730460/kazanskie_molocnye_sosi.jpg	in_stock	200.00 RUB		Kazan Delicacies	4680638721308	995004	new	yes	5740	Refrigerated Products > Boiled Sausages > Halal Sausages 'For Breakfast' without casing 45 g (0,5 kg) — Kazan Delicacies	RU:::0.00 RUB	0.500 kg	RU:20:y	no-returns-food		no	adult	no	RU	Kazan Delicacies	halal	refrigerated	Boiled Sausages		halal-#614A/2024
KD-028	Juicy Premium Halal Sausages (0,5 kg) — Kazan Delicacies	Beef sausages top grade, 0.4 kg, made in Kazan «Juicy» top-grade sausages by Kazan Delicacies — tender texture and rich meaty flavour from premium halal beef and aromatic spices. Perfect for breakfast, hot dishes and sandwiches. Suitable for retail, HoReCa and wholesale. Halal certified (DUM RT №614А/2024). Produced in Kazan, Tatarstan. Juicy Premium Halal Sausages (0,5 kg) — Kazan Delicacies — halal hams from Kazan Delicacies, refrigerated products category. Net weight: 0,5 kg. Shelf life: 30 days. Storage: 0-6 ˚C. HALAL certified #614A/2024 by the Muslim Spiritual Board of the Republic of Tatarstan (DUM RT). HACCP and ISO 22000 certified production facility. 100% pork-free, made from premium halal meats (beef, turkey, chicken, horse). Wholesale manufacturer direct from Kazan, Tatarstan, Russia. Shipment options: EXW Kazan warehouse or DC Lyubertsy (Moscow region).	https://pepperoni.tatar/en/products/kd-028	https://res.cloudinary.com/duygfl3vz/image/upload/v1784227277/%D0%B2%D0%B5%D1%82%D1%87%D0%B8%D0%BD%D0%B0_%D0%B8%D0%B7_%D0%B8%D0%BD%D0%B4%D0%B5%D0%B8%CC%86%D0%BA%D0%B8_1_znbt38.jpg	https://res.cloudinary.com/duygfl3vz/image/upload/v1784227446/%D0%92%D0%B5%D1%82%D1%87%D0%B8%D0%BD%D0%B0_%D0%B8%D0%B7_%D0%98%D0%BD%D0%B4%D0%B5%D0%B8%CC%86%D0%BA%D0%B8_skd9x0.jpg,https://res.cloudinary.com/duygfl3vz/image/upload/w_800/v1772730471/sosiski_k_zavtraku_xexv.jpg,https://res.cloudinary.com/duygfl3vz/image/upload/w_800/v1772730441/sosiski_k_zavtraku_4_tw.jpg,https://res.cloudinary.com/duygfl3vz/image/upload/w_800/v1772730442/sosiski_k_zavtraku_2_un.jpg,https://res.cloudinary.com/duygfl3vz/image/upload/w_800/v1772730443/sosiski_k_zavtraku_3_hv.jpg,https://res.cloudinary.com/duygfl3vz/image/upload/w_800/v1772730429/sosiski_neznye_apvsmk.jpg	in_stock	380.00 RUB		Kazan Delicacies	4680638720554	999946	new	yes	431	Refrigerated Products > Hams > Juicy Premium Halal Sausages (0,5 kg) — Kazan Delicacies	RU:::0.00 RUB	0.500 kg	RU:20:y	no-returns-food		no	adult	no	RU	Kazan Delicacies	halal	refrigerated	Hams		halal-#614A/2024
KD-029	Buinskiye Sausages — Halal (0,5 kg) — Kazan Delicacies	Juicy halal beef & poultry sausages from Kazan Buinskiye sausages are crafted from premium beef and poultry using traditional Tatar recipes. Tender, juicy texture with a rich meaty flavour and aromatic spices — perfect for retail, HoReCa and wholesale. Halal certified (DUM RT №614А/2024). Made in Kazan, Tatarstan. Buinskiye Sausages — Halal (0,5 kg) — Kazan Delicacies — halal hams from Kazan Delicacies, refrigerated products category. Net weight: 0,5 kg. Shelf life: 30 days. Storage: 0-6 ˚C. HALAL certified #614A/2024 by the Muslim Spiritual Board of the Republic of Tatarstan (DUM RT). HACCP and ISO 22000 certified production facility. 100% pork-free, made from premium halal meats (beef, turkey, chicken, horse). Wholesale manufacturer direct from Kazan, Tatarstan, Russia. Shipment options: EXW Kazan warehouse or DC Lyubertsy (Moscow region).	https://pepperoni.tatar/en/products/kd-029	https://res.cloudinary.com/duygfl3vz/image/upload/v1772730359/mramornaa_govaz_a_vetcina_f8phhh.jpg	https://res.cloudinary.com/duygfl3vz/image/upload/v1772730391/vetcina_mramornaa3_lnhk65.jpg,https://res.cloudinary.com/duygfl3vz/image/upload/w_800/v1772730471/sosiski_k_zavtraku_xexv.jpg,https://res.cloudinary.com/duygfl3vz/image/upload/w_800/v1772730441/sosiski_k_zavtraku_4_tw.jpg,https://res.cloudinary.com/duygfl3vz/image/upload/w_800/v1772730442/sosiski_k_zavtraku_2_un.jpg,https://res.cloudinary.com/duygfl3vz/image/upload/w_800/v1772730443/sosiski_k_zavtraku_3_hv.jpg,https://res.cloudinary.com/duygfl3vz/image/upload/w_800/v1772730429/sosiski_neznye_apvsmk.jpg	in_stock	398.00 RUB		Kazan Delicacies	4680638720271	999997	new	yes	431	Refrigerated Products > Hams > Buinskiye Sausages — Halal (0,5 kg) — Kazan Delicacies	RU:::0.00 RUB	0.500 kg	RU:20:y	no-returns-food		no	adult	no	RU	Kazan Delicacies	halal	refrigerated	Hams		halal-#614A/2024
KD-030	Halal Boiled Beef Sausage «From Beef» (0,5 kg) — Kazan Delicacies	Halal-certified, Kazan — 0.5 kg, 30 days Tender boiled sausage made from premium halal beef, crafted in Kazan, Tatarstan. Mild, lightly spiced flavour — perfect for sandwiches, hot dishes and deli platters. Halal-certified (DUM RT). Suitable for retail, HoReCa and wholesale. Produced by Kazan Delicacies. Halal Boiled Beef Sausage «From Beef» (0,5 kg) — Kazan Delicacies — halal hams from Kazan Delicacies, refrigerated products category. Net weight: 0,5 kg. Shelf life: 30 days. Storage: 0-6 ˚C. HALAL certified #614A/2024 by the Muslim Spiritual Board of the Republic of Tatarstan (DUM RT). HACCP and ISO 22000 certified production facility. 100% pork-free, made from premium halal meats (beef, turkey, chicken, horse). Wholesale manufacturer direct from Kazan, Tatarstan, Russia. Shipment options: EXW Kazan warehouse or DC Lyubertsy (Moscow region).	https://pepperoni.tatar/en/products/kd-030	https://res.cloudinary.com/duygfl3vz/image/upload/v1772730359/kurinaa_vetcina_iclj6f.jpg	https://res.cloudinary.com/duygfl3vz/image/upload/v1784227502/%D0%92%D0%B5%D1%82%D1%87%D0%B8%D0%BD%D0%B0_%D0%B8%D0%B7_%D0%9A%D1%83%D1%80%D0%B8%D1%86%D1%8B_dmnuw8.jpg,https://res.cloudinary.com/duygfl3vz/image/upload/w_800/v1772730471/sosiski_k_zavtraku_xexv.jpg,https://res.cloudinary.com/duygfl3vz/image/upload/w_800/v1772730441/sosiski_k_zavtraku_4_tw.jpg,https://res.cloudinary.com/duygfl3vz/image/upload/w_800/v1772730442/sosiski_k_zavtraku_2_un.jpg,https://res.cloudinary.com/duygfl3vz/image/upload/w_800/v1772730443/sosiski_k_zavtraku_3_hv.jpg,https://res.cloudinary.com/duygfl3vz/image/upload/w_800/v1772730429/sosiski_neznye_apvsmk.jpg	in_stock	350.00 RUB		Kazan Delicacies	4680638720547	999941	new	yes	431	Refrigerated Products > Hams > Halal Boiled Beef Sausage «From Beef» (0,5 kg) — Kazan Delicacies	RU:::0.00 RUB	0.500 kg	RU:20:y	no-returns-food		no	adult	no	RU	Kazan Delicacies	halal	refrigerated	Hams		halal-#614A/2024
KD-031	Assorted Halal Cooked Sausage (0,45 kg) — Kazan Delicacies	Chilled halal cooked sausage, 0.5 kg, made in Kazan Tender cooked sausage «Assorted» by Kazan Delicacies — a balanced blend of beef and poultry with mild aromatic spices. Smooth texture and delicate flavour suit home kitchens, HoReCa, retail chains and wholesale buyers. Produced in Kazan, Tatarstan. Halal certified (DUM RT №614А/2024). Shelf life 30 days at 0–6 °C. Assorted Halal Cooked Sausage (0,45 kg) — Kazan Delicacies — halal smoked meats from Kazan Delicacies, refrigerated products category. Net weight: 0,45 kg. Shelf life: 30 days. Storage: 0-6 ˚C. HALAL certified #614A/2024 by the Muslim Spiritual Board of the Republic of Tatarstan (DUM RT). HACCP and ISO 22000 certified production facility. 100% pork-free, made from premium halal meats (beef, turkey, chicken, horse). Wholesale manufacturer direct from Kazan, Tatarstan, Russia. Shipment options: EXW Kazan warehouse or DC Lyubertsy (Moscow region).	https://pepperoni.tatar/en/products/kd-031	https://res.cloudinary.com/duygfl3vz/image/upload/v1784213103/%D0%A1%D0%B5%D1%80%D0%B2%D0%B5%D0%BB%D0%B0%D1%82_%D1%85%D0%B0%D0%BD%D1%81%D0%BA%D0%B8%D0%B8%CC%86_jlvpkw.jpg	https://res.cloudinary.com/duygfl3vz/image/upload/v1784213226/%D0%A1%D0%B5%D1%80%D0%B2%D0%B5%D0%BB%D0%B0%D1%82_%D0%A5%D0%B0%D0%BD%D1%81%D0%BA%D0%B8%D0%B8%CC%86_2_evybfe.jpg,https://res.cloudinary.com/duygfl3vz/image/upload/w_800/v1772730471/sosiski_k_zavtraku_xexv.jpg,https://res.cloudinary.com/duygfl3vz/image/upload/w_800/v1772730441/sosiski_k_zavtraku_4_tw.jpg,https://res.cloudinary.com/duygfl3vz/image/upload/w_800/v1772730442/sosiski_k_zavtraku_2_un.jpg,https://res.cloudinary.com/duygfl3vz/image/upload/w_800/v1772730443/sosiski_k_zavtraku_3_hv.jpg,https://res.cloudinary.com/duygfl3vz/image/upload/w_800/v1772730429/sosiski_neznye_apvsmk.jpg	in_stock	216.00 RUB		Kazan Delicacies	4680638720285	999975	new	yes	5740	Refrigerated Products > Smoked Meats > Assorted Halal Cooked Sausage (0,45 kg) — Kazan Delicacies	RU:::0.00 RUB	0.450 kg	RU:20:y	no-returns-food		no	adult	no	RU	Kazan Delicacies	halal	refrigerated	Smoked Meats		halal-#614A/2024
KD-032	"Halal Servelat ""Po-Tatarski"" (450 g) — Kazan Delicacies"	"Servelat ""Po-Tatarski"" is a classic meat sausage that is perfect for sandwiches, appetizers, and restaurant presentations. With its combination of beef, beef fat, and aromatic spices, including fresh garlic, this product offers a vibrant taste and appetizing aroma.e color fixative, a complex blend of spices, and fresh garlic. Does not contain GMOs. Shelf life: up to 30 days at a temperature of 0 to +6 °C in vacuum packaging. HALAL certified #614A/2024 by the Muslim Spiritual Board of the Republic of Tatarstan (DUM RT). HACCP and ISO 22000 certified production facility. 100% pork-free, made from premium halal meats (beef, turkey, chicken, horse). Wholesale manufacturer direct from Kazan, Tatarstan, Russia. Shipment options: EXW Kazan warehouse or DC Lyubertsy (Moscow region)."	https://pepperoni.tatar/en/products/kd-032	https://res.cloudinary.com/duygfl3vz/image/upload/v1772730372/bol_soi%CC%86_servelat_po_tatarski_vareno-kopcenyi%CC%86_filei%CC%86nyi%CC%86_fluqsp.jpg	https://res.cloudinary.com/duygfl3vz/image/upload/v1784227655/%D0%A1%D0%B5%D1%80%D0%B2%D0%B5%D0%BB%D0%B0%D1%82_%D0%BF%D0%BE-%D1%82%D0%B0%D1%82%D0%B0%D1%80%D1%81%D0%BA%D0%B8_%D0%B2-%D0%BA_wfffod.jpg,https://res.cloudinary.com/duygfl3vz/image/upload/w_800/v1772730471/sosiski_k_zavtraku_xexv.jpg,https://res.cloudinary.com/duygfl3vz/image/upload/w_800/v1772730441/sosiski_k_zavtraku_4_tw.jpg,https://res.cloudinary.com/duygfl3vz/image/upload/w_800/v1772730442/sosiski_k_zavtraku_2_un.jpg,https://res.cloudinary.com/duygfl3vz/image/upload/w_800/v1772730443/sosiski_k_zavtraku_3_hv.jpg,https://res.cloudinary.com/duygfl3vz/image/upload/w_800/v1772730429/sosiski_neznye_apvsmk.jpg	in_stock	298.00 RUB		Kazan Delicacies	4680638720295	999994	new	yes	5740	"Refrigerated Products > Smoked Meats > Halal Servelat ""Po-Tatarski"" (450 g) — Kazan Delicacies"	RU:::0.00 RUB	0.450 kg	RU:20:y	no-returns-food		no	adult	no	RU	Kazan Delicacies	halal	refrigerated	Smoked Meats		halal-#614A/2024
KD-033	Halal Sausages Juicy 0.4 kg (0,45 kg) — Kazan Delicacies	Halal sausages from Kazan Juicy premium sausages 'Sausages Juicy' by Kazan Delicacies (pepperoni.tatar). Perfect for breakfast, hot dishes, and snacks. Made in Tatarstan, Halal certified. Suitable for HoReCa, wholesale, and retail. Rich taste and tender texture. Store at 0-6°C. Shelf life: 30 days. Halal Sausages Juicy 0.4 kg (0,45 kg) — Kazan Delicacies — halal smoked meats from Kazan Delicacies, refrigerated products category. Net weight: 0,45 kg. Shelf life: 30 days. Storage: 0-6 ˚C. HALAL certified #614A/2024 by the Muslim Spiritual Board of the Republic of Tatarstan (DUM RT). HACCP and ISO 22000 certified production facility. 100% pork-free, made from premium halal meats (beef, turkey, chicken, horse). Wholesale manufacturer direct from Kazan, Tatarstan, Russia. Shipment options: EXW Kazan warehouse or DC Lyubertsy (Moscow region).	https://pepperoni.tatar/en/products/kd-033	https://res.cloudinary.com/duygfl3vz/image/upload/v1772730380/kolbasa_polukopcenaa_iz_indei%CC%86ki_ptvshr.jpg	https://res.cloudinary.com/duygfl3vz/image/upload/v1772730376/polukopcenaa_iz_indei%CC%86ki_2_yny2x2.jpg,https://res.cloudinary.com/duygfl3vz/image/upload/w_800/v1772730471/sosiski_k_zavtraku_xexv.jpg,https://res.cloudinary.com/duygfl3vz/image/upload/w_800/v1772730441/sosiski_k_zavtraku_4_tw.jpg,https://res.cloudinary.com/duygfl3vz/image/upload/w_800/v1772730442/sosiski_k_zavtraku_2_un.jpg,https://res.cloudinary.com/duygfl3vz/image/upload/w_800/v1772730443/sosiski_k_zavtraku_3_hv.jpg,https://res.cloudinary.com/duygfl3vz/image/upload/w_800/v1772730429/sosiski_neznye_apvsmk.jpg	in_stock	348.00 RUB		Kazan Delicacies	4680638720639	999910	new	yes	5740	Refrigerated Products > Smoked Meats > Halal Sausages Juicy 0.4 kg (0,45 kg) — Kazan Delicacies	RU:::0.00 RUB	0.450 kg	RU:20:y	no-returns-food		no	adult	no	RU	Kazan Delicacies	halal	refrigerated	Smoked Meats		halal-#614A/2024
KD-034	Halal Buinsky Sausages 240 g (0,45 kg) — Kazan Delicacies	Halal, chilled, natural casing Buinsky Sausages are juicy and flavorful halal meat products from Kazan, made with natural casing. Perfect for boiling, frying, or baking — ideal for breakfast, lunch, or dinner. Suitable for HoReCa, wholesale, and retail. Shelf life 30 days at 0–6 °C. Natural casing locks in moisture and taste. From Kazan Delicacies — authentic Tatar quality. Halal Buinsky Sausages 240 g (0,45 kg) — Kazan Delicacies — halal smoked meats from Kazan Delicacies, refrigerated products category. Net weight: 0,45 kg. Shelf life: 30 days. Storage: 0-6 ˚C. HALAL certified #614A/2024 by the Muslim Spiritual Board of the Republic of Tatarstan (DUM RT). HACCP and ISO 22000 certified production facility. 100% pork-free, made from premium halal meats (beef, turkey, chicken, horse). Wholesale manufacturer direct from Kazan, Tatarstan, Russia. Shipment options: EXW Kazan warehouse or DC Lyubertsy (Moscow region).	https://pepperoni.tatar/en/products/kd-034	https://res.cloudinary.com/duygfl3vz/image/upload/v1772730364/kolbasa_polukopcenaa_iz_govadiny_xkbeao.jpg	https://res.cloudinary.com/duygfl3vz/image/upload/v1772730376/polukopcenaa_iz_govadiny_2_zllh0c.jpg,https://res.cloudinary.com/duygfl3vz/image/upload/w_800/v1772730471/sosiski_k_zavtraku_xexv.jpg,https://res.cloudinary.com/duygfl3vz/image/upload/w_800/v1772730441/sosiski_k_zavtraku_4_tw.jpg,https://res.cloudinary.com/duygfl3vz/image/upload/w_800/v1772730442/sosiski_k_zavtraku_2_un.jpg,https://res.cloudinary.com/duygfl3vz/image/upload/w_800/v1772730443/sosiski_k_zavtraku_3_hv.jpg,https://res.cloudinary.com/duygfl3vz/image/upload/w_800/v1772730429/sosiski_neznye_apvsmk.jpg	in_stock	358.00 RUB		Kazan Delicacies	4680638720349	999961	new	yes	5740	Refrigerated Products > Smoked Meats > Halal Buinsky Sausages 240 g (0,45 kg) — Kazan Delicacies	RU:::0.00 RUB	0.450 kg	RU:20:y	no-returns-food		no	adult	no	RU	Kazan Delicacies	halal	refrigerated	Smoked Meats		halal-#614A/2024
KD-036	Halal boiled assorted meats 0.5 kg (0,54 kg) — Kazan Delicacies	Tender meat selection from Kazan Boiled Assorted by Kazan Delicacies is a juicy and tender meat product with a classic flavor, perfect for sandwiches, appetizers and salads. Made from premium halal ingredients using traditional recipes, without artificial additives. Suitable for HoReCa, wholesale and retail. Store at 0-6 °C for up to 30 days. Halal certified. Halal boiled assorted meats 0.5 kg (0,54 kg) — Kazan Delicacies — halal smoked meats from Kazan Delicacies, refrigerated products category. Net weight: 0,54 kg. Shelf life: 30 days. Storage: 0-6 ˚C. HALAL certified #614A/2024 by the Muslim Spiritual Board of the Republic of Tatarstan (DUM RT). HACCP and ISO 22000 certified production facility. 100% pork-free, made from premium halal meats (beef, turkey, chicken, horse). Wholesale manufacturer direct from Kazan, Tatarstan, Russia. Shipment options: EXW Kazan warehouse or DC Lyubertsy (Moscow region).	https://pepperoni.tatar/en/products/kd-036	https://res.cloudinary.com/duygfl3vz/image/upload/v1772730391/bol_saa_kolbasa_vareno-kopcenaa_ramazan_pp6qug.jpg	https://res.cloudinary.com/duygfl3vz/image/upload/v1772730376/ramazan_vse_vidy_narezki.1_gcmke9.jpg,https://res.cloudinary.com/duygfl3vz/image/upload/w_800/v1772730471/sosiski_k_zavtraku_xexv.jpg,https://res.cloudinary.com/duygfl3vz/image/upload/w_800/v1772730441/sosiski_k_zavtraku_4_tw.jpg,https://res.cloudinary.com/duygfl3vz/image/upload/w_800/v1772730442/sosiski_k_zavtraku_2_un.jpg,https://res.cloudinary.com/duygfl3vz/image/upload/w_800/v1772730443/sosiski_k_zavtraku_3_hv.jpg,https://res.cloudinary.com/duygfl3vz/image/upload/w_800/v1772730429/sosiski_neznye_apvsmk.jpg	in_stock	377.00 RUB		Kazan Delicacies	4680638721315	995005	new	yes	5740	Refrigerated Products > Smoked Meats > Halal boiled assorted meats 0.5 kg (0,54 kg) — Kazan Delicacies	RU:::0.00 RUB	0.540 kg	RU:20:y	no-returns-food		no	adult	no	RU	Kazan Delicacies	halal	refrigerated	Smoked Meats		halal-#614A/2024
KD-037	Halal Boiled Tender 0.5 kg (0,27 kg) — Kazan Delicacies	Halal, chilled, in casing Delicate boiled sausage made from selected meat following Tatar traditions. Perfect for sandwiches, salads, and snacks. Produced in Kazan under strict Halal supervision. Suitable for HoReCa, wholesale, and retail. Juicy, wholesome, and clean. Halal Boiled Tender 0.5 kg (0,27 kg) — Kazan Delicacies — halal smoked meats from Kazan Delicacies, refrigerated products category. Net weight: 0,27 kg. Shelf life: 30 days. Storage: 0-6 ˚C. HALAL certified #614A/2024 by the Muslim Spiritual Board of the Republic of Tatarstan (DUM RT). HACCP and ISO 22000 certified production facility. 100% pork-free, made from premium halal meats (beef, turkey, chicken, horse). Wholesale manufacturer direct from Kazan, Tatarstan, Russia. Shipment options: EXW Kazan warehouse or DC Lyubertsy (Moscow region).	https://pepperoni.tatar/en/products/kd-037	https://res.cloudinary.com/duygfl3vz/image/upload/v1772730365/kolbas_vvareno-kopcenaa_ramazan_sliauh.jpg	https://res.cloudinary.com/duygfl3vz/image/upload/v1772730376/ramazan_vse_vidy_narezki.1_gcmke9.jpg,https://res.cloudinary.com/duygfl3vz/image/upload/w_800/v1772730471/sosiski_k_zavtraku_xexv.jpg,https://res.cloudinary.com/duygfl3vz/image/upload/w_800/v1772730441/sosiski_k_zavtraku_4_tw.jpg,https://res.cloudinary.com/duygfl3vz/image/upload/w_800/v1772730442/sosiski_k_zavtraku_2_un.jpg,https://res.cloudinary.com/duygfl3vz/image/upload/w_800/v1772730443/sosiski_k_zavtraku_3_hv.jpg,https://res.cloudinary.com/duygfl3vz/image/upload/w_800/v1772730429/sosiski_neznye_apvsmk.jpg	in_stock	188.00 RUB		Kazan Delicacies	4680638721322	995012	new	yes	5740	Refrigerated Products > Smoked Meats > Halal Boiled Tender 0.5 kg (0,27 kg) — Kazan Delicacies	RU:::0.00 RUB	0.270 kg	RU:20:y	no-returns-food		no	adult	no	RU	Kazan Delicacies	halal	refrigerated	Smoked Meats		halal-#614A/2024
