id	title	description	link	image_link	additional_image_link	availability	price	sale_price	brand	gtin	mpn	condition	identifier_exists	google_product_category	product_type	shipping	shipping_weight	tax	return_policy_label	multipack	is_bundle	age_group	adult	country_of_origin	manufacturer	custom_label_0	custom_label_1	custom_label_2	custom_label_3	custom_label_4
KD-013	Halal Sliced Turkey Ham 0.5 kg (0,5 kg) — Kazan Delicacies	Halal, frozen –18°C Tender turkey ham for sandwiches, salads and pizza. Perfect for HoReCa and retail. Halal, made in Kazan. Shelf life 180 days. Halal Sliced Turkey Ham 0.5 kg (0,5 kg) — Kazan Delicacies — halal toppings from Kazan Delicacies, frozen products category. Net weight: 0,5 kg. Shelf life: 360 days. Storage: –18°C. Diameter: 50-55 mm. HALAL certified #614A/2024 by the Muslim Spiritual Board of the Republic of Tatarstan (DUM RT). HACCP and ISO 22000 certified production facility. 100% pork-free, made from premium halal meats (beef, turkey, chicken, horse). Wholesale manufacturer direct from Kazan, Tatarstan, Russia. Shipment options: EXW Kazan warehouse or DC Lyubertsy (Moscow region).	https://pepperoni.tatar/en/products/kd-013	https://res.cloudinary.com/duygfl3vz/image/upload/v1772730326/pepperoni_narezka_bol_saa_azeom7.jpg	https://res.cloudinary.com/duygfl3vz/image/upload/v1772730312/pepperoni_3_stuki_zpezfy.jpg,https://res.cloudinary.com/duygfl3vz/image/upload/v1772700231/pepperoni_vid_sverhu_j0nucc.jpg,https://res.cloudinary.com/duygfl3vz/image/upload/w_800/v1772730305/sosiski_v_razreze_iz_govadiny_vonrzp.jpg,https://res.cloudinary.com/duygfl3vz/image/upload/w_800/v1772730305/sosiski_dla_hot_dogov_iz_gov.jpg,https://res.cloudinary.com/duygfl3vz/image/upload/w_800/v1772730310/sosiski_2_masa_1.2_c1zz.jpg,https://res.cloudinary.com/duygfl3vz/image/upload/w_800/v1772730305/sosiski_dla_hot_dogov_d.jpg	in_stock	274.00 RUB		Kazan Delicacies	4680638720318	KD-013	new	yes	420	Frozen Products > Toppings > Halal Sliced Turkey Ham 0.5 kg (0,5 kg) — Kazan Delicacies	RU:::0.00 RUB	0.500 kg	RU:20:y	no-returns-food		no	adult	no	RU	Kazan Delicacies	halal	frozen	Toppings		halal-#614A/2024
KD-014	Halal Horse meat pepperoni 0.5 kg (1 kg) — Kazan Delicacies	Halal pepperoni from Kazan Rich, smoky horse meat pepperoni with authentic spice blend. Perfect for pizza, toppings, and hot dishes. Halal-certified, made in Tatarstan. Suitable for HoReCa, wholesale, and retail. Frozen at –18°C, 360-day shelf life. No soy, no GMO. Natural casing. Halal Horse meat pepperoni 0.5 kg (1 kg) — Kazan Delicacies — halal toppings from Kazan Delicacies, frozen products category. Net weight: 1 kg. Shelf life: 360 days. Storage: –18°C. Diameter: 50-55 mm. HALAL certified #614A/2024 by the Muslim Spiritual Board of the Republic of Tatarstan (DUM RT). HACCP and ISO 22000 certified production facility. 100% pork-free, made from premium halal meats (beef, turkey, chicken, horse). Wholesale manufacturer direct from Kazan, Tatarstan, Russia. Shipment options: EXW Kazan warehouse or DC Lyubertsy (Moscow region).	https://pepperoni.tatar/en/products/kd-014	https://res.cloudinary.com/duygfl3vz/image/upload/v1772730328/pepperoni_zel_naa_t8rfjn.jpg	https://res.cloudinary.com/duygfl3vz/image/upload/v1772730328/pepperoni_ikic7r.jpg,https://res.cloudinary.com/duygfl3vz/image/upload/v1772700231/pepperoni_vid_sverhu_j0nucc.jpg,https://res.cloudinary.com/duygfl3vz/image/upload/w_800/v1772730305/sosiski_v_razreze_iz_govadiny_vonrzp.jpg,https://res.cloudinary.com/duygfl3vz/image/upload/w_800/v1772730305/sosiski_dla_hot_dogov_iz_gov.jpg,https://res.cloudinary.com/duygfl3vz/image/upload/w_800/v1772730310/sosiski_2_masa_1.2_c1zz.jpg,https://res.cloudinary.com/duygfl3vz/image/upload/w_800/v1772730305/sosiski_dla_hot_dogov_d.jpg	in_stock	457.00 RUB		Kazan Delicacies		KD-014	new	no	420	Frozen Products > Toppings > Halal Horse meat pepperoni 0.5 kg (1 kg) — Kazan Delicacies	RU:::0.00 RUB	1.000 kg	RU:20:y	no-returns-food		no	adult	no	RU	Kazan Delicacies	halal	frozen	Toppings		halal-#614A/2024
KD-015	Halal Pepperoni cooked-smoked classic (1 кг kg) — Kazan Delicacies	Halal, 0.5 kg, for pizza and baking Our classic cooked-smoked pepperoni, diameter 50–55 mm, is perfect for pizza, sandwiches, and hot dishes. Made in Kazan according to Halal standards. No soy or GMOs. Ideal for HoReCa chefs, wholesale, and retail. Shelf life 360 days at –18°C. Enjoy rich smoked flavor. Halal Pepperoni cooked-smoked classic (1 кг kg) — Kazan Delicacies — halal toppings from Kazan Delicacies, frozen products category. Net weight: 1 кг kg. Shelf life: 30 days. Storage: 0-6 ˚C. HALAL certified #614A/2024 by the Muslim Spiritual Board of the Republic of Tatarstan (DUM RT). HACCP and ISO 22000 certified production facility. 100% pork-free, made from premium halal meats (beef, turkey, chicken, horse). Wholesale manufacturer direct from Kazan, Tatarstan, Russia. Shipment options: EXW Kazan warehouse or DC Lyubertsy (Moscow region).	https://pepperoni.tatar/en/products/kd-015	https://res.cloudinary.com/duygfl3vz/image/upload/v1772730364/kurinaa_grudka_1_bl8203.jpg	https://res.cloudinary.com/duygfl3vz/image/upload/v1772730361/kurinaa_grudka_v_razreze_o3124p.jpg,https://res.cloudinary.com/duygfl3vz/image/upload/w_800/v1772730305/sosiski_v_razreze_iz_govadiny_vonrzp.jpg,https://res.cloudinary.com/duygfl3vz/image/upload/w_800/v1772730305/sosiski_dla_hot_dogov_iz_gov.jpg,https://res.cloudinary.com/duygfl3vz/image/upload/w_800/v1772730310/sosiski_2_masa_1.2_c1zz.jpg,https://res.cloudinary.com/duygfl3vz/image/upload/w_800/v1772730305/sosiski_dla_hot_dogov_d.jpg,https://res.cloudinary.com/duygfl3vz/image/upload/w_800/v1772700280/0413-FELI4477_mluz2n.jpg	in_stock	412.00 RUB		Kazan Delicacies		KD-015	new	no	420	Frozen Products > Toppings > Halal Pepperoni cooked-smoked classic (1 кг kg) — Kazan Delicacies	RU:::0.00 RUB	1.000 kg	RU:20:y	no-returns-food		no	adult	no	RU	Kazan Delicacies	halal	frozen	Toppings		halal-#614A/2024
KD-016	Halal Classic cooked-smoked pepperoni whole stick (1 кг kg) — Kazan Delicacies	Halal meat product from Kazan Whole stick of classic cooked-smoked pepperoni. Perfect for pizza, sandwiches, and snacks. Halal-certified, made in Kazan. Suitable for HoReCa, wholesale, and retail. Store at -18°C up to 360 days. Rich flavor, firm texture. Halal Classic cooked-smoked pepperoni whole stick (1 кг kg) — Kazan Delicacies — halal toppings from Kazan Delicacies, frozen products category. Net weight: 1 кг kg. Shelf life: 30 days. Storage: 0-6 ˚C. HALAL certified #614A/2024 by the Muslim Spiritual Board of the Republic of Tatarstan (DUM RT). HACCP and ISO 22000 certified production facility. 100% pork-free, made from premium halal meats (beef, turkey, chicken, horse). Wholesale manufacturer direct from Kazan, Tatarstan, Russia. Shipment options: EXW Kazan warehouse or DC Lyubertsy (Moscow region).	https://pepperoni.tatar/en/products/kd-016	https://res.cloudinary.com/duygfl3vz/image/upload/w_800/v1772730305/sosiski_v_razreze_iz_govadiny_vonrzp.jpg	https://res.cloudinary.com/duygfl3vz/image/upload/w_800/v1772730305/sosiski_dla_hot_dogov_iz_gov.jpg,https://res.cloudinary.com/duygfl3vz/image/upload/w_800/v1772730310/sosiski_2_masa_1.2_c1zz.jpg,https://res.cloudinary.com/duygfl3vz/image/upload/w_800/v1772730305/sosiski_dla_hot_dogov_d.jpg,https://res.cloudinary.com/duygfl3vz/image/upload/w_800/v1772700280/0413-FELI4477_mluz2n.jpg,https://res.cloudinary.com/duygfl3vz/image/upload/w_800/v1772730316/sosiski_tri_perza_s_syr.jpg,https://res.cloudinary.com/duygfl3vz/image/upload/w_800/v1772730300/sosiski_dla_hot_dogov_t.jpg	in_stock	449.00 RUB		Kazan Delicacies		KD-016	new	no	420	Frozen Products > Toppings > Halal Classic cooked-smoked pepperoni whole stick (1 кг kg) — Kazan Delicacies	RU:::0.00 RUB	1.000 kg	RU:20:y	no-returns-food		no	adult	no	RU	Kazan Delicacies	halal	frozen	Toppings		halal-#614A/2024
KD-018	Halal Pepperoni whole smoked stick 1 kg — Kazan Delicacies	Halal, –18°C, 360 days Whole pepperoni stick for pizza and snacks. Spicy, rich flavor, firm texture. Perfect for HoReCa, wholesale and retail. Made in Kazan, halal certified. Store at –18°C. Halal Pepperoni whole smoked stick 1 kg — Kazan Delicacies — halal sausages & frankfurters from Kazan Delicacies, refrigerated products category. Net weight: 1 kg. Shelf life: 30 days. Storage: 0-6 ˚C. Casing: casingless. HALAL certified #614A/2024 by the Muslim Spiritual Board of the Republic of Tatarstan (DUM RT). HACCP and ISO 22000 certified production facility. 100% pork-free, made from premium halal meats (beef, turkey, chicken, horse). Wholesale manufacturer direct from Kazan, Tatarstan, Russia. Shipment options: EXW Kazan warehouse or DC Lyubertsy (Moscow region).	https://pepperoni.tatar/en/products/kd-018	https://res.cloudinary.com/duygfl3vz/image/upload/v1772730442/sosiski_k_zavtraku_2_unjwfb.jpg	https://res.cloudinary.com/duygfl3vz/image/upload/v1772730443/sosiski_k_zavtraku_3_hv0eel.jpg,https://res.cloudinary.com/duygfl3vz/image/upload/v1772730441/sosiski_k_zavtraku_4_twgspu.jpg,https://res.cloudinary.com/duygfl3vz/image/upload/w_800/v1772730471/sosiski_k_zavtraku_xexv.jpg,https://res.cloudinary.com/duygfl3vz/image/upload/w_800/v1772730441/sosiski_k_zavtraku_4_tw.jpg,https://res.cloudinary.com/duygfl3vz/image/upload/w_800/v1772730442/sosiski_k_zavtraku_2_un.jpg,https://res.cloudinary.com/duygfl3vz/image/upload/w_800/v1772730443/sosiski_k_zavtraku_3_hv.jpg	in_stock	245.00 RUB		Kazan Delicacies		KD-018	new	no	5740	Refrigerated Products > Sausages & Frankfurters > Halal Pepperoni whole smoked stick 1 kg — Kazan Delicacies	RU:::0.00 RUB	1.000 kg	RU:20:y	no-returns-food		no	adult	no	RU	Kazan Delicacies	halal	refrigerated	Sausages & Frankfurters		halal-#614A/2024
KD-017	Halal Breakfast Sausages (80 g × 6 pcs) — Kazan Delicacies	Breakfast Sausages are a versatile product for home cooking and HORECA. Due to their soft texture and balanced spices, they are perfect for breakfasts, hot dogs, and hot dishes.e color fixer, and a complex blend of spices. Does not contain GMOs. Shelf life: up to 30 days at a temperature of 0 to +6 °C in vacuum packaging. Halal Breakfast Sausages (80 g × 6 pcs) — Kazan Delicacies — halal sausages & frankfurters from Kazan Delicacies, refrigerated products category. Net weight: 0,4 kg. Shelf life: 30 days. Storage: 0-6 ˚C. Diameter: 0 mm. Casing: natural casing. HALAL certified #614A/2024 by the Muslim Spiritual Board of the Republic of Tatarstan (DUM RT). HACCP and ISO 22000 certified production facility. 100% pork-free, made from premium halal meats (beef, turkey, chicken, horse). Wholesale manufacturer direct from Kazan, Tatarstan, Russia. Shipment options: EXW Kazan warehouse or DC Lyubertsy (Moscow region).	https://pepperoni.tatar/en/products/kd-017	https://res.cloudinary.com/duygfl3vz/image/upload/v1772730471/sosiski_k_zavtraku_xexvj5.jpg	https://res.cloudinary.com/duygfl3vz/image/upload/v1772730441/sosiski_k_zavtraku_4_twgspu.jpg,https://res.cloudinary.com/duygfl3vz/image/upload/w_800/v1772730471/sosiski_k_zavtraku_xexv.jpg,https://res.cloudinary.com/duygfl3vz/image/upload/w_800/v1772730441/sosiski_k_zavtraku_4_tw.jpg,https://res.cloudinary.com/duygfl3vz/image/upload/w_800/v1772730442/sosiski_k_zavtraku_2_un.jpg,https://res.cloudinary.com/duygfl3vz/image/upload/w_800/v1772730443/sosiski_k_zavtraku_3_hv.jpg,https://res.cloudinary.com/duygfl3vz/image/upload/w_800/v1772730429/sosiski_neznye_apvsmk.jpg	in_stock	135.00 RUB		Kazan Delicacies	4680638720578	999921	new	yes	5740	Refrigerated Products > Sausages & Frankfurters > Halal Breakfast Sausages (80 g × 6 pcs) — Kazan Delicacies	RU:::0.00 RUB	0.400 kg	RU:20:y	no-returns-food		no	adult	no	RU	Kazan Delicacies	halal	refrigerated	Sausages & Frankfurters		halal-#614A/2024
KD-019	Halal Delicate Sausages (80 g × 6 pcs) — Kazan Delicacies	Delicate Sausages are a versatile product for home cooking and HORECA. With a combination of turkey fillet, chicken meat, and beef, they have a soft texture and balanced flavor. Suitable for breakfast, hot dogs, and quick cooking.e color fixative, and a complex blend of spices. Does not contain GMOs. Shelf life: up to 30 days at a temperature of 0 to +6 °C in vacuum packaging. HALAL certified #614A/2024 by the Muslim Spiritual Board of the Republic of Tatarstan (DUM RT). HACCP and ISO 22000 certified production facility. 100% pork-free, made from premium halal meats (beef, turkey, chicken, horse). Wholesale manufacturer direct from Kazan, Tatarstan, Russia. Shipment options: EXW Kazan warehouse or DC Lyubertsy (Moscow region).	https://pepperoni.tatar/en/products/kd-019	https://res.cloudinary.com/duygfl3vz/image/upload/v1772730429/sosiski_neznye_apvsmk.jpg	https://res.cloudinary.com/duygfl3vz/image/upload/v1772730430/sosiski_neznaa_jqh4xv.jpg,https://res.cloudinary.com/duygfl3vz/image/upload/w_800/v1772730471/sosiski_k_zavtraku_xexv.jpg,https://res.cloudinary.com/duygfl3vz/image/upload/w_800/v1772730441/sosiski_k_zavtraku_4_tw.jpg,https://res.cloudinary.com/duygfl3vz/image/upload/w_800/v1772730442/sosiski_k_zavtraku_2_un.jpg,https://res.cloudinary.com/duygfl3vz/image/upload/w_800/v1772730443/sosiski_k_zavtraku_3_hv.jpg,https://res.cloudinary.com/duygfl3vz/image/upload/w_800/v1772730429/sosiski_neznye_apvsmk.jpg	in_stock	181.00 RUB		Kazan Delicacies	4680638720035	999976	new	yes	5740	Refrigerated Products > Sausages & Frankfurters > Halal Delicate Sausages (80 g × 6 pcs) — Kazan Delicacies	RU:::0.00 RUB	0.400 kg	RU:20:y	no-returns-food		no	adult	no	RU	Kazan Delicacies	halal	refrigerated	Sausages & Frankfurters		halal-#614A/2024
KD-020	Halal Kazan's Sausages with Milk for Breakfasts, Hot Dishes, and HORECA - Chilled — Kazan Delicacies	Delicate sausages made from beef and chicken fillet with the addition of milk, featuring a mild taste and juicy texture. Kazan's Sausages with Milk are a versatile product for home cooking and HORECA. The combination of beef, chicken fillet, and milk gives the sausages a delicate texture and rich flavor. The aromatic spices (black pepper, allspice, and nutmeg) make them a great option for breakfasts and hot dishes.e color fixer, sugar, and spices. Shelf life: up to 30 days at a temperature of 0 to +6 °C in vacuum packaging. HALAL certified #614A/2024 by the Muslim Spiritual Board of the Republic of Tatarstan (DUM RT). HACCP and ISO 22000 certified production facility. 100% pork-free, made from premium halal meats (beef, turkey, chicken, horse). Wholesale manufacturer direct from Kazan, Tatarstan, Russia. Shipment options: EXW Kazan warehouse or DC Lyubertsy (Moscow region).	https://pepperoni.tatar/en/products/kd-020	https://res.cloudinary.com/duygfl3vz/image/upload/v1772730460/kazanskie_molocnye_sosiski_zl1ifo.jpg	https://res.cloudinary.com/duygfl3vz/image/upload/v1772730462/kazanskie_socnye_sosiski_c4q1cm.jpg,https://res.cloudinary.com/duygfl3vz/image/upload/w_800/v1772730471/sosiski_k_zavtraku_xexv.jpg,https://res.cloudinary.com/duygfl3vz/image/upload/w_800/v1772730441/sosiski_k_zavtraku_4_tw.jpg,https://res.cloudinary.com/duygfl3vz/image/upload/w_800/v1772730442/sosiski_k_zavtraku_2_un.jpg,https://res.cloudinary.com/duygfl3vz/image/upload/w_800/v1772730443/sosiski_k_zavtraku_3_hv.jpg,https://res.cloudinary.com/duygfl3vz/image/upload/w_800/v1772730429/sosiski_neznye_apvsmk.jpg	in_stock	235.00 RUB		Kazan Delicacies	4680638720059	999978	new	yes	5740	Refrigerated Products > Sausages & Frankfurters > Halal Kazan's Sausages with Milk for Breakfasts, Hot Dishes, and HORECA - Chilled — Kazan Delicacies	RU:::0.00 RUB	0.400 kg	RU:20:y	no-returns-food		no	adult	no	RU	Kazan Delicacies	halal	refrigerated	Sausages & Frankfurters		halal-#614A/2024
KD-021	"Halal Sausages ""With Cheese"" (130 g × 5 pieces) — Kazan Delicacies"	"Sausages ""With Cheese"" are a versatile product for home cooking and HORECA. Thanks to the combination of beef, chicken fillet, and hard cheese, the sausages have a rich flavor and a delicate texture. They are suitable for breakfast, hot dogs, and quick cooking.e, and a complex blend of spices. They do not contain GMOs. Shelf life: up to 30 days at a temperature of 0 to +6 °C in vacuum packaging. HALAL certified #614A/2024 by the Muslim Spiritual Board of the Republic of Tatarstan (DUM RT). HACCP and ISO 22000 certified production facility. 100% pork-free, made from premium halal meats (beef, turkey, chicken, horse). Wholesale manufacturer direct from Kazan, Tatarstan, Russia. Shipment options: EXW Kazan warehouse or DC Lyubertsy (Moscow region)."	https://pepperoni.tatar/en/products/kd-021	https://res.cloudinary.com/duygfl3vz/image/upload/v1772730434/sosiski_kazanskie_s_syrom_1.1_eeaaav.jpg	https://res.cloudinary.com/duygfl3vz/image/upload/v1772730434/sosiski_kazanskie_s_syrom_iygsec.jpg,https://res.cloudinary.com/duygfl3vz/image/upload/v1772730428/sosiski_s_syrom_130_g_5_st_2_ctyyui.jpg,https://res.cloudinary.com/duygfl3vz/image/upload/w_800/v1772730471/sosiski_k_zavtraku_xexv.jpg,https://res.cloudinary.com/duygfl3vz/image/upload/w_800/v1772730441/sosiski_k_zavtraku_4_tw.jpg,https://res.cloudinary.com/duygfl3vz/image/upload/w_800/v1772730442/sosiski_k_zavtraku_2_un.jpg,https://res.cloudinary.com/duygfl3vz/image/upload/w_800/v1772730443/sosiski_k_zavtraku_3_hv.jpg	in_stock	293.00 RUB		Kazan Delicacies	4680638720073	999975	new	yes	5740	"Refrigerated Products > Sausages & Frankfurters > Halal Sausages ""With Cheese"" (130 g × 5 pieces) — Kazan Delicacies"	RU:::0.00 RUB	0.400 kg	RU:20:y	no-returns-food		no	adult	no	RU	Kazan Delicacies	halal	refrigerated	Sausages & Frankfurters		halal-#614A/2024
KD-022	Halal Beef sausages for breakfast, hot dogs, and HORECA — chilled — Kazan Delicacies	Delicate beef sausages with natural spices, suitable for breakfast, hot dogs, and hot dishes. They retain their juiciness and rich flavor during cooking. Classic Beef sausages are a versatile solution for home cooking and HORECA. Their dense texture and aromatic spices (black pepper, cardamom) give them a rich flavor and make them a great alternative to traditional meat sausages.e color fixer, sugar, and spices. Does not contain GMOs. Shelf life: up to 30 days at a temperature of 0 to +6 °C in vacuum packaging HALAL certified #614A/2024 by the Muslim Spiritual Board of the Republic of Tatarstan (DUM RT). HACCP and ISO 22000 certified production facility. 100% pork-free, made from premium halal meats (beef, turkey, chicken, horse). Wholesale manufacturer direct from Kazan, Tatarstan, Russia. Shipment options: EXW Kazan warehouse or DC Lyubertsy (Moscow region).	https://pepperoni.tatar/en/products/kd-022	https://res.cloudinary.com/duygfl3vz/image/upload/v1772730455/sosiski_iz_govadiny_80_g_6_st_outyte.jpg	https://res.cloudinary.com/duygfl3vz/image/upload/v1772730444/sosiski_iz_govadiny_80_g_6_st_2_icliam.jpg,https://res.cloudinary.com/duygfl3vz/image/upload/w_800/v1772730471/sosiski_k_zavtraku_xexv.jpg,https://res.cloudinary.com/duygfl3vz/image/upload/w_800/v1772730441/sosiski_k_zavtraku_4_tw.jpg,https://res.cloudinary.com/duygfl3vz/image/upload/w_800/v1772730442/sosiski_k_zavtraku_2_un.jpg,https://res.cloudinary.com/duygfl3vz/image/upload/w_800/v1772730443/sosiski_k_zavtraku_3_hv.jpg,https://res.cloudinary.com/duygfl3vz/image/upload/w_800/v1772730429/sosiski_neznye_apvsmk.jpg	in_stock	284.00 RUB		Kazan Delicacies	4680638720097	999980	new	yes	5740	Refrigerated Products > Sausages & Frankfurters > Halal Beef sausages for breakfast, hot dogs, and HORECA — chilled — Kazan Delicacies	RU:::0.00 RUB	0.400 kg	RU:20:y	no-returns-food		no	adult	no	RU	Kazan Delicacies	halal	refrigerated	Sausages & Frankfurters		halal-#614A/2024
KD-023	Halal Chicken thigh fillet 1x1 cm cubes (0,4 kg) — Kazan Delicacies	Halal frozen meat cuts from Kazan Tender chicken thigh fillet diced into 1x1 cm cubes for quick cooking. Perfect for pilaf, soups, salads, and stir-fries. Halal certified, frozen. Made in Tatarstan. Suitable for HoReCa, wholesale, and retail. Juicy flavor and convenient format save kitchen prep time. Shelf life 180 days at -18°C. Halal Chicken thigh fillet 1x1 cm cubes (0,4 kg) — Kazan Delicacies — halal sausages & frankfurters from Kazan Delicacies, refrigerated products category. Net weight: 0,4 kg. Shelf life: 30 days. Storage: 0-6 ˚C. Casing: natural casing. HALAL certified #614A/2024 by the Muslim Spiritual Board of the Republic of Tatarstan (DUM RT). HACCP and ISO 22000 certified production facility. 100% pork-free, made from premium halal meats (beef, turkey, chicken, horse). Wholesale manufacturer direct from Kazan, Tatarstan, Russia. Shipment options: EXW Kazan warehouse or DC Lyubertsy (Moscow region).	https://pepperoni.tatar/en/products/kd-023	https://res.cloudinary.com/duygfl3vz/image/upload/v1772730454/sosiski_kazanskie_premium_srebyg.jpg	https://res.cloudinary.com/duygfl3vz/image/upload/v1772730455/sosiski_kazanskie_premium_udkadz.jpg,https://res.cloudinary.com/duygfl3vz/image/upload/v1772730429/sosiski_v-s_premium_xyky0a.jpg,https://res.cloudinary.com/duygfl3vz/image/upload/w_800/v1772730471/sosiski_k_zavtraku_xexv.jpg,https://res.cloudinary.com/duygfl3vz/image/upload/w_800/v1772730441/sosiski_k_zavtraku_4_tw.jpg,https://res.cloudinary.com/duygfl3vz/image/upload/w_800/v1772730442/sosiski_k_zavtraku_2_un.jpg,https://res.cloudinary.com/duygfl3vz/image/upload/w_800/v1772730443/sosiski_k_zavtraku_3_hv.jpg	in_stock	146.00 RUB		Kazan Delicacies	4680638721407	995001	new	yes	5740	Refrigerated Products > Sausages & Frankfurters > Halal Chicken thigh fillet 1x1 cm cubes (0,4 kg) — Kazan Delicacies	RU:::0.00 RUB	0.400 kg	RU:20:y	no-returns-food		no	adult	no	RU	Kazan Delicacies	halal	refrigerated	Sausages & Frankfurters		halal-#614A/2024
KD-024	Halal Chicken breast fillet cubes 1x1 cm (0,4 kg) — Kazan Delicacies	Frozen halal pre-cut meat from Kazan Natural chicken breast fillet diced into 1x1 cm cubes. Perfect for soups, salads, pilaf, and sauces. Halal certified, made in Kazan (Tatarstan). Ideal for HoReCa, wholesale, and retail. Quick to cook, juicy and tender. Shelf life 180 days at -18°C. Halal Chicken breast fillet cubes 1x1 cm (0,4 kg) — Kazan Delicacies — halal sausages & frankfurters from Kazan Delicacies, refrigerated products category. Net weight: 0,4 kg. Shelf life: 30 days. Storage: 0-6 ˚C. Casing: natural casing. HALAL certified #614A/2024 by the Muslim Spiritual Board of the Republic of Tatarstan (DUM RT). HACCP and ISO 22000 certified production facility. 100% pork-free, made from premium halal meats (beef, turkey, chicken, horse). Wholesale manufacturer direct from Kazan, Tatarstan, Russia. Shipment options: EXW Kazan warehouse or DC Lyubertsy (Moscow region).	https://pepperoni.tatar/en/products/kd-024	https://res.cloudinary.com/duygfl3vz/image/upload/v1772730454/sosiski_kazanskie_socnye_vntchs.jpg	https://res.cloudinary.com/duygfl3vz/image/upload/v1772730458/kazanskie_socnye_fw2ptj.jpg,https://res.cloudinary.com/duygfl3vz/image/upload/w_800/v1772730471/sosiski_k_zavtraku_xexv.jpg,https://res.cloudinary.com/duygfl3vz/image/upload/w_800/v1772730441/sosiski_k_zavtraku_4_tw.jpg,https://res.cloudinary.com/duygfl3vz/image/upload/w_800/v1772730442/sosiski_k_zavtraku_2_un.jpg,https://res.cloudinary.com/duygfl3vz/image/upload/w_800/v1772730443/sosiski_k_zavtraku_3_hv.jpg,https://res.cloudinary.com/duygfl3vz/image/upload/w_800/v1772730429/sosiski_neznye_apvsmk.jpg	in_stock	144.00 RUB		Kazan Delicacies	4680638721414	995002	new	yes	5740	Refrigerated Products > Sausages & Frankfurters > Halal Chicken breast fillet cubes 1x1 cm (0,4 kg) — Kazan Delicacies	RU:::0.00 RUB	0.400 kg	RU:20:y	no-returns-food		no	adult	no	RU	Kazan Delicacies	halal	refrigerated	Sausages & Frankfurters		halal-#614A/2024
KD-035	"Halal Sausages ""With Cheese"" (330 g) — Kazan Delicacies"	"Sausages ""With Cheese"" are an excellent option for grilling, breakfasts, and hot dishes. Thanks to the combination of beef, chicken fillet, and hard cheese, the product has a juicy texture and rich flavor. Suitable for cooking in a pan, on the grill, or serving as a hot appetizer.e color fixer, and a complex blend of spices. Does not contain GMOs. Shelf life: up to 30 days at a temperature of 0 to +6 °C. HALAL certified #614A/2024 by the Muslim Spiritual Board of the Republic of Tatarstan (DUM RT). HACCP and ISO 22000 certified production facility. 100% pork-free, made from premium halal meats (beef, turkey, chicken, horse). Wholesale manufacturer direct from Kazan, Tatarstan, Russia. Shipment options: EXW Kazan warehouse or DC Lyubertsy (Moscow region)."	https://pepperoni.tatar/en/products/kd-035	https://res.cloudinary.com/duygfl3vz/image/upload/v1772730361/kolbaski_s_syrom_2_lmewes.jpg	https://res.cloudinary.com/duygfl3vz/image/upload/v1772730362/kolbaski_s_syrom_v_razreze_vyd7il.jpg,https://res.cloudinary.com/duygfl3vz/image/upload/w_800/v1772730471/sosiski_k_zavtraku_xexv.jpg,https://res.cloudinary.com/duygfl3vz/image/upload/w_800/v1772730441/sosiski_k_zavtraku_4_tw.jpg,https://res.cloudinary.com/duygfl3vz/image/upload/w_800/v1772730442/sosiski_k_zavtraku_2_un.jpg,https://res.cloudinary.com/duygfl3vz/image/upload/w_800/v1772730443/sosiski_k_zavtraku_3_hv.jpg,https://res.cloudinary.com/duygfl3vz/image/upload/w_800/v1772730429/sosiski_neznye_apvsmk.jpg	in_stock	271.00 RUB		Kazan Delicacies	4680638720455	999964	new	yes	5740	"Refrigerated Products > Sausages & Frankfurters > Halal Sausages ""With Cheese"" (330 g) — Kazan Delicacies"	RU:::0.00 RUB	0.300 kg	RU:20:y	no-returns-food		no	adult	no	RU	Kazan Delicacies	halal	refrigerated	Sausages & Frankfurters		halal-#614A/2024
